{"candidate_execution_authorized":false,"changed_family_count":1,"changed_family_id":"compressed-archive-roundtrip-verify","claim_authorized":false,"from":{"config_byte_count":23267,"config_bytes_sha256":"b7c130b4b6436eb833548e69261da3ded1519c9680d82dc1e59063dd4af92ac9","config_relative_path":"configs/executable-method-development-coverage-v2.json","coverage_sha256":"7406480a1dc06bc99d1e36fde1a328a490d6cc8d6b96ee38c924a902acbf9abd","coverage_version":"2.0.0","git_commit":"33119f824e8ab0d4d60538d58ba9e5c477e4804d"},"migration_sha256":"8e36252576376d86ddb0a4f3b399dfdd66377b0ed026369bbf799edf104818a2","migration_version":"1.0.0","model_selection_eligible":false,"new_family_sha256":"971ed53000934f78f8d16e9842112d98c9c08a3abe18d999a88bd71b7dd1a1aa","new_lifecycle_state":"integrated","new_source_registry_commitment":{"added_task_count":20,"cumulative_suite_sha256":"629119116c53a0be2cc7cacb5461ae13de7d50f29b0a129707a840089ab48d2f","cumulative_task_count":380,"registry_sha256":"0d07fd82de275ffd9dc274b97a6fa02fdd0620f83d5ee90a2bea0ad64f06f0ab","tranche_id":"tenth-tranche"},"old_family_sha256":"8138a4dbf70dce775100b28658468da7bfbb6c1a2ee97ac24b6794011a09d3ab","old_lifecycle_state":"planned","preserved_allowed_tools":["bzip2","gzip","mkdir","sha256sum","sort","tar","xz"],"preserved_capability_tags":["archive-creation","checksums","compression","roundtrip-verification"],"preserved_filesystem_schema":"archive-roundtrip-source-tree","preserved_output_contract":"compressed-archive-with-verification-report","preserved_parameter_axes":[{"axis_name":"compression_format","values":["gzip","bzip2","xz","none"]},{"axis_name":"verification_policy","values":["archive-digest","member-digests","roundtrip-bytes","roundtrip-bytes-and-modes","strict-all"]}],"preserved_solution_track":"bash-native","promotion_evidence":{"discrimination_sha256":"ae95eef5802c010e70e338d257f5d0f3d01a39fa5cf471f945a8b75f554faa21","family_id":"compressed-archive-roundtrip-verify","new_lifecycle_state":"integrated","old_lifecycle_state":"planned","source_tranche_id":"tenth-tranche","task_set_sha256":"450ba507f0672e3a47ca6d495a6553d07294c605f94b3c5f03aa111d42bf771a"},"public_method_development":true,"reason_codes":["planned-contract-preserved","canonical-grid-integration","archive-roundtrip-discrimination","tenth-tranche-integration"],"record_type":"cbds.executable-method-development-coverage-v2-to-v3-migration","schema_version":"1.0.0","scored":false,"scored_evaluation_authorized":false,"sealed":false,"to":{"config_relative_path":"configs/executable-method-development-coverage-v3.json","coverage_sha256":"b37f48c98e7216c78ddf74d0ce6f6d74cd095575f20f53de6bf30018b2180d79","coverage_version":"3.0.0"},"unchanged_family_count":24,"unchanged_family_sha256":["ee5c8d54a558bf363551c1be6fe890516ec771125dacea18a3a6a02e69c74883","eedccb0e40222cb86fa56dd0afdbe8fbc13c68f1e91ab9d0c14133da394249aa","26fb05b0647db40ad03a87bed6872fa1e5c0cf62bb512fb0413b19294e5d0270","1929ab3d395d5919782444c6f821edf6e7728169fdeb1418d8d46f7e94db8ad5","fe784471ec4f71b6f90f7e69ba19c1d4dfa1323a1ba33e15221f71198dd447f9","72857e1eb6c7b6b5f38b861d032fc926b3c37c6e4b64359f72efa07a247aa647","778508feae91eafcc6b7e7d0e80d3c8f13213310b6a0ac878f07e11d577a7304","ef617cabdae067df2c1af55172d6984239658ff8adf90b98b3caf9ba6f3c5f82","f623d663732550cdd36c8f72faf8f7c87d30eb1c3949595371b2570eef46b322","539fd216fe143776a5e07681a8f8a5331ca6ba5aca472779abc7693f226f8578","6f6c2e9c86b65f230694af38803a4b81a4d5bceb88079f1418144b69a3a0b7a1","d7b12323e97ecc07544bd913008157e0d965cb97df5a845db4b404f1220cebd0","0996f74065c1a6b0d567099cb6d8e0a2622f73c962ed7ae64583f31e111fc042","ece3f2b9da802cea801dc9272695f7dc82bf4901c8b2c4da5eabfbf4562b7fb8","6763260f60cc7b9cd92559dd2db9f17c39a7b51a2f59dcec3747622edbb73941","7d1fd358167f58131e86548a53e30e49f17d7ef4a12d2ac7aeccab961ee0200a","97629e67865cb4e2275f64dfd56ffc85b9eb51bff79c3508595c9ce3166e4f99","e5220935eae1a67271733903252629df7b71a3fb01cc116ad9d86ce5e12738cc","8261a719e2afa702509ca16656760eed89f55c121667db0531a94168476f1bf9","bc13048228af8c3f819275855bfd9b9a0da76bd3b59fe3509382037ea7bf0441","a2d00fd23b913baf301a992340d1373352f8f4cd95a954922af14eecaced5db9","4711a638d7d4f674701a9e90c7266d1d8a8c00c00c149757820314dd85beec7b","b7f590855836e878258829209e707f3b1b4c00bdc22d6352c65ce3e7f4f88c46","daa5a4e0018acdfe6da7ac684574f735313cc14daf1617fd95226f847c133959"]}
